{
  "$schema": "https://json-schema.org/draft/2020-12/schema",
  "$id": "https://github.com/laravel-template-admin/modules/max-bot/messages.schema.json",
  "title": "Bot messages registry",
  "description": "Общий реестр сообщений бота. Источник правды по кодам, меткам, описаниям и значениям по умолчанию; читается и Laravel (App\\Support\\BotMessageCatalog), и Python (repositories/messages.py). Переопределения админа хранятся отдельно — в таблице bot_messages.",
  "type": "array",
  "minItems": 1,
  "items": {
    "type": "object",
    "additionalProperties": false,
    "required": ["code", "label", "description", "default"],
    "properties": {
      "code": {
        "type": "string",
        "description": "Машинный код сообщения (совпадает с колонкой bot_messages.code и константами в repositories/messages.py).",
        "pattern": "^[a-z0-9_]+$",
        "minLength": 1,
        "maxLength": 128
      },
      "label": {
        "type": "string",
        "description": "Человекочитаемая метка для UI админки.",
        "minLength": 1
      },
      "description": {
        "type": "string",
        "description": "Когда отправляется это сообщение (подсказка в админке).",
        "minLength": 1
      },
      "default": {
        "type": "string",
        "description": "Текст по умолчанию (инлайн-HTML), если нет активного переопределения в bot_messages.",
        "minLength": 1
      }
    }
  }
}
