[
    {
        "code": "welcome",
        "label": "Приветствие",
        "description": "Отправляется при запуске бота (/start).",
        "default": "Привет, я бот."
    },
    {
        "code": "bot_added",
        "label": "Добавление в чат",
        "description": "Отправляется, когда бота добавили в чат.",
        "default": "Спасибо, что добавили меня!"
    },
    {
        "code": "bot_removed",
        "label": "Удаление из чата",
        "description": "Отправляется, когда бота удалили из чата.",
        "default": "Меня удалили из чата."
    },
    {
        "code": "bot_stopped",
        "label": "Остановка бота",
        "description": "Отправляется, когда бота остановили.",
        "default": "Бот остановлен."
    },
    {
        "code": "bot_started",
        "label": "Запуск бота",
        "description": "Отправляется, когда бота запустили.",
        "default": "Бот запущен."
    },
    {
        "code": "message_created",
        "label": "Сообщение создано",
        "description": "Отправляется, когда получено сообщение.",
        "default": "Сообщение создано."
    },
    {
        "code": "message_callback",
        "label": "Колбэк сообщения",
        "description": "Отправляется, когда получен колбэк сообщения.",
        "default": "Колбэк сообщения."
    },
    {
        "code": "message_edited",
        "label": "Сообщение отредактировано",
        "description": "Отправляется, когда отредактировали сообщение.",
        "default": "Сообщение отредактировано."
    },
    {
        "code": "message_removed",
        "label": "Сообщение удалено",
        "description": "Отправляется, когда удалили сообщение.",
        "default": "Сообщение удалено."
    },
    {
        "code": "user_added",
        "label": "Добавление пользователя",
        "description": "Отправляется, когда добавили пользователя.",
        "default": "Пользователь добавлен."
    },
    {
        "code": "user_removed",
        "label": "Удаление пользователя",
        "description": "Отправляется, когда удалили пользователя.",
        "default": "Пользователь удален."
    },
    {
        "code": "chat_title_changed",
        "label": "Изменение названия чата",
        "description": "Отправляется, когда изменили название чата.",
        "default": "Название чата изменено."
    },
    {
        "code": "dialog_cleared",
        "label": "Очистка диалога",
        "description": "Отправляется, когда очистили диалог.",
        "default": "Диалог очищен."
    },
    {
        "code": "dialog_muted",
        "label": "Заглушка диалога",
        "description": "Отправляется, когда заглушили диалог.",
        "default": "Диалог заглушен."
    },
    {
        "code": "dialog_unmuted",
        "label": "Разглушка диалога",
        "description": "Отправляется, когда разглушили диалог.",
        "default": "Диалог разглушен."
    },
    {
        "code": "dialog_removed",
        "label": "Удаление диалога",
        "description": "Отправляется, когда удалили диалог.",
        "default": "Диалог удален."
    }
]
